{
  "source_url": "https://www.amazon.com/Logitech-Wireless-Mouse-M185-Swift/dp/B004YAVF8I",
  "source_item_name": "Logitech M185 Wireless Mouse, 2.4GHz with USB Mini Receiver, 12-Month Battery Life, 1000 DPI Optical Tracking, Ambidextrous, Compatible with PC, Mac, Laptop - Swift Grey",
  "source_pics": [
    "https://m.media-amazon.com/images/I/51WN5aXZWIL._AC_SY355_.jpg",
    "https://m.media-amazon.com/images/I/51WN5aXZWIL._AC_SY450_.jpg",
    "https://m.media-amazon.com/images/I/51WN5aXZWIL._AC_SX425_.jpg",
    "https://m.media-amazon.com/images/I/51WN5aXZWIL._AC_SX466_.jpg",
    "https://m.media-amazon.com/images/I/51WN5aXZWIL._AC_SX522_.jpg",
    "https://m.media-amazon.com/images/I/51WN5aXZWIL._AC_SX569_.jpg",
    "https://m.media-amazon.com/images/I/51WN5aXZWIL._AC_SX679_.jpg",
    "https://m.media-amazon.com/images/I/51WN5aXZWIL._AC_SY300_SX300_QL70_FMwebp_.jpg"
  ],
  "descriptions": [
    "Compact Mouse: With a comfortable and contoured shape, this Logitech ambidextrous wireless mouse feels great in either right or left hand and is far superior to a touchpad",
    "Durable and Reliable: This USB wireless mouse features a line-by-line scroll wheel, up to 1 year of battery life (2) thanks to a smart sleep mode function, and comes with the included AA battery",
    "Universal Compatibility: Your Logitech mouse works with your Windows PC, Mac, or laptop, so no matter what type of computer you own today or buy tomorrow your mouse will be compatible",
    "Plug and Play Simplicity: Just plug in the tiny nano USB receiver and start working in seconds with a strong, reliable connection to your wireless computer mouse up to 33 feet / 10 m (5)",
    "Better than touchpad: Get more done by adding M185 to your laptop; according to a recent study, laptop users who chose this mouse over a touchpad were 50% more productive (3) and worked 30% faster (4)",
    "Small and portable: The compact size and smooth cursor control make this mouse suitable for small to medium hands, tight workspaces or offices, and busy desktops",
    "The plastic parts in M185 include certified post consumer recycled plastic (77% for black and 49% for Charcoal/Grey, Black/Blue Glossy & Black/Red Glossy (6))",
    "Product carbon footprint: 3.97 kg CO2e",
    "Note: In case of Wireless mouse, the USB receiver will be provided inside or along with the mouse",
    "Plug-and-play wireless: Get a reliable connection from a convenient nano receiver that stays in your computer",
    "1-year battery life: Go for a full year without a battery change (Battery life may vary based on user and computing conditions)",
    "Logitech reliability: Made by the global leader for mice and backed by a 3-year limited hardware warranty",
    "Contoured shape: Gives you more comfort and control",
    "For Windows and Mac computers: No software or setup hassles-start using your mouse right away",
    "Logitech Wireless Mouse M185. A simple, reliable mouse with plug-and-play wireless, a 1-year battery life and 3-year limited hardware warranty.(Battery life may vary based on user and computing conditions.) System Requirements: Windows Vista Windows 7 Windows 8 Windows 10|Mac OS X 10.5 or later|Chrome OS|Linux kernel 2.6+|USB port."
  ],
  "source_origin_price": 17.99,
  "source_activity_price": 13.99,
  "source_price_currency": "USD",
  "props": {
    "Brand": "Logitech",
    "Color": "Swift Grey",
    "Connectivity Technology": "USB",
    "Special Feature": "Wireless",
    "Movement Detection Technology": "Optical",
    "Additional Features": "Wireless",
    "Movement Detection": "Optical",
    "Button Quantity": "1",
    "Hand Orientation": "Ambidextrous",
    "Compatible Devices": "Personal Computer",
    "Operating System": "mac os x",
    "Battery Average Life": "12 months",
    "Number of Batteries": "1 AA batteries required. (included)",
    "Hardware Platform": "Mac, PC",
    "Power Source": "Battery Powered",
    "Mouse Maximum Sensitivity": "1000 Dots per Inch",
    "Minimum Required Operating System Version": "ChromeOS 137, Mac OS 13 Ventura, Windows 11",
    "Range": "feet",
    "Style Name": "USB Receiver",
    "Item Weight": "30 Grams",
    "Item Dimensions L x W": "1.54\"L x 3.89\"W",
    "Unit Count": "1.0 Count",
    "Model Name": "910-002225",
    "Antenna Location": "Personal",
    "Model Number": "910-002225",
    "Built-In Media": "Computer Peripherals^Mice^Computer Mice^",
    "Are Batteries Included": "Yes",
    "Are Batteries Required": "Yes",
    "Manufacturer": "Logitech, Inc",
    "UPC": "097855074126",
    "Global Trade Identification Number": "00097855074126",
    "Mfr Part Number": "910-002225",
    "Warranty Description": "3 year limited",
    "Item Type Name": "Logitech Wireless Mouse M185 (910-002225)",
    "ASIN": "B004YAVF8I",
    "Enclosure Material": "Metal"
  },
  "skus": [
    {
      "sku_props": {
        "ASIN": "B004YAVF8I",
        "Color": "Swift Grey",
        "Style Name": "USB Receiver"
      },
      "source_origin_price": 17.99,
      "source_activity_price": 13.99,
      "source_pics": [
        "https://m.media-amazon.com/images/I/51WN5aXZWIL._AC_SY355_.jpg",
        "https://m.media-amazon.com/images/I/51WN5aXZWIL._AC_SY450_.jpg",
        "https://m.media-amazon.com/images/I/51WN5aXZWIL._AC_SX425_.jpg",
        "https://m.media-amazon.com/images/I/51WN5aXZWIL._AC_SX466_.jpg",
        "https://m.media-amazon.com/images/I/51WN5aXZWIL._AC_SX522_.jpg",
        "https://m.media-amazon.com/images/I/51WN5aXZWIL._AC_SX569_.jpg"
      ],
      "status": 1
    }
  ],
  "status": 1,
  "source_score": 4.5,
  "source_cmms": 42764,
  "not_detail": null
}